01/01/2023;2023-01-01 09:36;2023-01-01 15:18
02/01/2023;2023-01-02 09:35;2023-01-02 15:20
03/01/2023;2023-01-03 09:35;2023-01-03 15:21
04/01/2023;2023-01-04 09:34;2023-01-04 15:23
05/01/2023;2023-01-05 09:33;2023-01-05 15:25
06/01/2023;2023-01-06 09:32;2023-01-06 15:27
07/01/2023;2023-01-07 09:31;2023-01-07 15:29
08/01/2023;2023-01-08 09:30;2023-01-08 15:31
09/01/2023;2023-01-09 09:29;2023-01-09 15:33
10/01/2023;2023-01-10 09:27;2023-01-10 15:35
11/01/2023;2023-01-11 09:26;2023-01-11 15:37
12/01/2023;2023-01-12 09:25;2023-01-12 15:39
13/01/2023;2023-01-13 09:23;2023-01-13 15:41
14/01/2023;2023-01-14 09:22;2023-01-14 15:44
15/01/2023;2023-01-15 09:20;2023-01-15 15:46
16/01/2023;2023-01-16 09:18;2023-01-16 15:49
17/01/2023;2023-01-17 09:17;2023-01-17 15:51
18/01/2023;2023-01-18 09:15;2023-01-18 15:53
19/01/2023;2023-01-19 09:13;2023-01-19 15:56
20/01/2023;2023-01-20 09:11;2023-01-20 15:58
21/01/2023;2023-01-21 09:09;2023-01-21 16:01
22/01/2023;2023-01-22 09:07;2023-01-22 16:04
23/01/2023;2023-01-23 09:05;2023-01-23 16:06
24/01/2023;2023-01-24 09:03;2023-01-24 16:09
25/01/2023;2023-01-25 09:01;2023-01-25 16:12
26/01/2023;2023-01-26 08:58;2023-01-26 16:14
27/01/2023;2023-01-27 08:56;2023-01-27 16:17
28/01/2023;2023-01-28 08:54;2023-01-28 16:20
29/01/2023;2023-01-29 08:51;2023-01-29 16:22
30/01/2023;2023-01-30 08:49;2023-01-30 16:25
31/01/2023;2023-01-31 08:47;2023-01-31 16:28
01/02/2023;2023-02-01 08:44;2023-02-01 16:31
02/02/2023;2023-02-02 08:42;2023-02-02 16:34
03/02/2023;2023-02-03 08:39;2023-02-03 16:36
04/02/2023;2023-02-04 08:37;2023-02-04 16:39
05/02/2023;2023-02-05 08:34;2023-02-05 16:42
06/02/2023;2023-02-06 08:31;2023-02-06 16:45
07/02/2023;2023-02-07 08:29;2023-02-07 16:47
08/02/2023;2023-02-08 08:26;2023-02-08 16:50
09/02/2023;2023-02-09 08:23;2023-02-09 16:53
10/02/2023;2023-02-10 08:21;2023-02-10 16:56
11/02/2023;2023-02-11 08:18;2023-02-11 16:58
12/02/2023;2023-02-12 08:15;2023-02-12 17:01
13/02/2023;2023-02-13 08:12;2023-02-13 17:04
14/02/2023;2023-02-14 08:10;2023-02-14 17:07
15/02/2023;2023-02-15 08:07;2023-02-15 17:10
16/02/2023;2023-02-16 08:04;2023-02-16 17:12
17/02/2023;2023-02-17 08:01;2023-02-17 17:15
18/02/2023;2023-02-18 07:58;2023-02-18 17:18
19/02/2023;2023-02-19 07:55;2023-02-19 17:21
20/02/2023;2023-02-20 07:52;2023-02-20 17:23
21/02/2023;2023-02-21 07:49;2023-02-21 17:26
22/02/2023;2023-02-22 07:46;2023-02-22 17:29
23/02/2023;2023-02-23 07:44;2023-02-23 17:31
24/02/2023;2023-02-24 07:41;2023-02-24 17:34
25/02/2023;2023-02-25 07:38;2023-02-25 17:37
26/02/2023;2023-02-26 07:35;2023-02-26 17:39
27/02/2023;2023-02-27 07:32;2023-02-27 17:42
28/02/2023;2023-02-28 07:29;2023-02-28 17:45
01/03/2023;2023-03-01 07:25;2023-03-01 17:47
02/03/2023;2023-03-02 07:22;2023-03-02 17:50
03/03/2023;2023-03-03 07:19;2023-03-03 17:53
04/03/2023;2023-03-04 07:16;2023-03-04 17:55
05/03/2023;2023-03-05 07:13;2023-03-05 17:58
06/03/2023;2023-03-06 07:10;2023-03-06 18:01
07/03/2023;2023-03-07 07:07;2023-03-07 18:03
08/03/2023;2023-03-08 07:04;2023-03-08 18:06
09/03/2023;2023-03-09 07:01;2023-03-09 18:08
10/03/2023;2023-03-10 06:58;2023-03-10 18:11
11/03/2023;2023-03-11 06:55;2023-03-11 18:14
12/03/2023;2023-03-12 06:52;2023-03-12 18:16
13/03/2023;2023-03-13 06:49;2023-03-13 18:19
14/03/2023;2023-03-14 06:45;2023-03-14 18:21
15/03/2023;2023-03-15 06:42;2023-03-15 18:24
16/03/2023;2023-03-16 06:39;2023-03-16 18:27
17/03/2023;2023-03-17 06:36;2023-03-17 18:29
18/03/2023;2023-03-18 06:33;2023-03-18 18:32
19/03/2023;2023-03-19 06:30;2023-03-19 18:34
20/03/2023;2023-03-20 06:27;2023-03-20 18:37
21/03/2023;2023-03-21 06:23;2023-03-21 18:39
22/03/2023;2023-03-22 06:20;2023-03-22 18:42
23/03/2023;2023-03-23 06:17;2023-03-23 18:45
24/03/2023;2023-03-24 06:14;2023-03-24 18:47
25/03/2023;2023-03-25 06:11;2023-03-25 18:50
26/03/2023;2023-03-26 06:08;2023-03-26 18:52
27/03/2023;2023-03-27 06:05;2023-03-27 18:55
28/03/2023;2023-03-28 06:01;2023-03-28 18:57
29/03/2023;2023-03-29 05:58;2023-03-29 19:00
30/03/2023;2023-03-30 05:55;2023-03-30 19:02
31/03/2023;2023-03-31 05:52;2023-03-31 19:05
01/04/2023;2023-04-01 05:49;2023-04-01 19:08
02/04/2023;2023-04-02 05:46;2023-04-02 19:10
03/04/2023;2023-04-03 05:43;2023-04-03 19:13
04/04/2023;2023-04-04 05:39;2023-04-04 19:15
05/04/2023;2023-04-05 05:36;2023-04-05 19:18
06/04/2023;2023-04-06 05:33;2023-04-06 19:20
07/04/2023;2023-04-07 05:30;2023-04-07 19:23
08/04/2023;2023-04-08 05:27;2023-04-08 19:26
09/04/2023;2023-04-09 05:24;2023-04-09 19:28
10/04/2023;2023-04-10 05:21;2023-04-10 19:31
11/04/2023;2023-04-11 05:18;2023-04-11 19:33
12/04/2023;2023-04-12 05:15;2023-04-12 19:36
13/04/2023;2023-04-13 05:11;2023-04-13 19:38
14/04/2023;2023-04-14 05:08;2023-04-14 19:41
15/04/2023;2023-04-15 05:05;2023-04-15 19:44
16/04/2023;2023-04-16 05:02;2023-04-16 19:46
17/04/2023;2023-04-17 04:59;2023-04-17 19:49
18/04/2023;2023-04-18 04:56;2023-04-18 19:51
19/04/2023;2023-04-19 04:53;2023-04-19 19:54
20/04/2023;2023-04-20 04:50;2023-04-20 19:57
21/04/2023;2023-04-21 04:47;2023-04-21 19:59
22/04/2023;2023-04-22 04:44;2023-04-22 20:02
23/04/2023;2023-04-23 04:41;2023-04-23 20:05
24/04/2023;2023-04-24 04:38;2023-04-24 20:07
25/04/2023;2023-04-25 04:35;2023-04-25 20:10
26/04/2023;2023-04-26 04:32;2023-04-26 20:12
27/04/2023;2023-04-27 04:29;2023-04-27 20:15
28/04/2023;2023-04-28 04:26;2023-04-28 20:18
29/04/2023;2023-04-29 04:23;2023-04-29 20:20
30/04/2023;2023-04-30 04:20;2023-04-30 20:23
01/05/2023;2023-05-01 04:17;2023-05-01 20:26
02/05/2023;2023-05-02 04:15;2023-05-02 20:28
03/05/2023;2023-05-03 04:12;2023-05-03 20:31
04/05/2023;2023-05-04 04:09;2023-05-04 20:34
05/05/2023;2023-05-05 04:06;2023-05-05 20:36
06/05/2023;2023-05-06 04:03;2023-05-06 20:39
07/05/2023;2023-05-07 04:01;2023-05-07 20:41
08/05/2023;2023-05-08 03:58;2023-05-08 20:44
09/05/2023;2023-05-09 03:55;2023-05-09 20:47
10/05/2023;2023-05-10 03:53;2023-05-10 20:49
11/05/2023;2023-05-11 03:50;2023-05-11 20:52
12/05/2023;2023-05-12 03:47;2023-05-12 20:54
13/05/2023;2023-05-13 03:45;2023-05-13 20:57
14/05/2023;2023-05-14 03:42;2023-05-14 20:59
15/05/2023;2023-05-15 03:40;2023-05-15 21:02
16/05/2023;2023-05-16 03:37;2023-05-16 21:05
17/05/2023;2023-05-17 03:35;2023-05-17 21:07
18/05/2023;2023-05-18 03:32;2023-05-18 21:09
19/05/2023;2023-05-19 03:30;2023-05-19 21:12
20/05/2023;2023-05-20 03:27;2023-05-20 21:14
21/05/2023;2023-05-21 03:25;2023-05-21 21:17
22/05/2023;2023-05-22 03:23;2023-05-22 21:19
23/05/2023;2023-05-23 03:21;2023-05-23 21:22
24/05/2023;2023-05-24 03:19;2023-05-24 21:24
25/05/2023;2023-05-25 03:16;2023-05-25 21:26
26/05/2023;2023-05-26 03:14;2023-05-26 21:28
27/05/2023;2023-05-27 03:12;2023-05-27 21:31
28/05/2023;2023-05-28 03:10;2023-05-28 21:33
29/05/2023;2023-05-29 03:09;2023-05-29 21:35
30/05/2023;2023-05-30 03:07;2023-05-30 21:37
31/05/2023;2023-05-31 03:05;2023-05-31 21:39
01/06/2023;2023-06-01 03:03;2023-06-01 21:41
02/06/2023;2023-06-02 03:02;2023-06-02 21:43
03/06/2023;2023-06-03 03:00;2023-06-03 21:45
04/06/2023;2023-06-04 02:59;2023-06-04 21:46
05/06/2023;2023-06-05 02:57;2023-06-05 21:48
06/06/2023;2023-06-06 02:56;2023-06-06 21:50
07/06/2023;2023-06-07 02:55;2023-06-07 21:51
08/06/2023;2023-06-08 02:53;2023-06-08 21:53
09/06/2023;2023-06-09 02:52;2023-06-09 21:54
10/06/2023;2023-06-10 02:51;2023-06-10 21:55
11/06/2023;2023-06-11 02:50;2023-06-11 21:57
12/06/2023;2023-06-12 02:50;2023-06-12 21:58
13/06/2023;2023-06-13 02:49;2023-06-13 21:59
14/06/2023;2023-06-14 02:48;2023-06-14 22:00
15/06/2023;2023-06-15 02:48;2023-06-15 22:01
16/06/2023;2023-06-16 02:47;2023-06-16 22:01
17/06/2023;2023-06-17 02:47;2023-06-17 22:02
18/06/2023;2023-06-18 02:47;2023-06-18 22:03
19/06/2023;2023-06-19 02:47;2023-06-19 22:03
20/06/2023;2023-06-20 02:47;2023-06-20 22:03
21/06/2023;2023-06-21 02:47;2023-06-21 22:04
22/06/2023;2023-06-22 02:47;2023-06-22 22:04
23/06/2023;2023-06-23 02:47;2023-06-23 22:04
24/06/2023;2023-06-24 02:48;2023-06-24 22:04
25/06/2023;2023-06-25 02:48;2023-06-25 22:04
26/06/2023;2023-06-26 02:49;2023-06-26 22:03
27/06/2023;2023-06-27 02:50;2023-06-27 22:03
28/06/2023;2023-06-28 02:50;2023-06-28 22:03
29/06/2023;2023-06-29 02:51;2023-06-29 22:02
30/06/2023;2023-06-30 02:52;2023-06-30 22:01
01/07/2023;2023-07-01 02:53;2023-07-01 22:01
02/07/2023;2023-07-02 02:54;2023-07-02 22:00
03/07/2023;2023-07-03 02:56;2023-07-03 21:59
04/07/2023;2023-07-04 02:57;2023-07-04 21:58
05/07/2023;2023-07-05 02:58;2023-07-05 21:57
06/07/2023;2023-07-06 03:00;2023-07-06 21:55
07/07/2023;2023-07-07 03:01;2023-07-07 21:54
08/07/2023;2023-07-08 03:03;2023-07-08 21:53
09/07/2023;2023-07-09 03:05;2023-07-09 21:51
10/07/2023;2023-07-10 03:07;2023-07-10 21:50
11/07/2023;2023-07-11 03:08;2023-07-11 21:48
12/07/2023;2023-07-12 03:10;2023-07-12 21:47
13/07/2023;2023-07-13 03:12;2023-07-13 21:45
14/07/2023;2023-07-14 03:14;2023-07-14 21:43
15/07/2023;2023-07-15 03:16;2023-07-15 21:41
16/07/2023;2023-07-16 03:18;2023-07-16 21:39
17/07/2023;2023-07-17 03:20;2023-07-17 21:37
18/07/2023;2023-07-18 03:23;2023-07-18 21:35
19/07/2023;2023-07-19 03:25;2023-07-19 21:33
20/07/2023;2023-07-20 03:27;2023-07-20 21:31
21/07/2023;2023-07-21 03:29;2023-07-21 21:29
22/07/2023;2023-07-22 03:32;2023-07-22 21:27
23/07/2023;2023-07-23 03:34;2023-07-23 21:24
24/07/2023;2023-07-24 03:36;2023-07-24 21:22
25/07/2023;2023-07-25 03:39;2023-07-25 21:20
26/07/2023;2023-07-26 03:41;2023-07-26 21:17
27/07/2023;2023-07-27 03:43;2023-07-27 21:15
28/07/2023;2023-07-28 03:46;2023-07-28 21:12
29/07/2023;2023-07-29 03:48;2023-07-29 21:10
30/07/2023;2023-07-30 03:51;2023-07-30 21:07
31/07/2023;2023-07-31 03:53;2023-07-31 21:05
01/08/2023;2023-08-01 03:56;2023-08-01 21:02
02/08/2023;2023-08-02 03:58;2023-08-02 20:59
03/08/2023;2023-08-03 04:01;2023-08-03 20:57
04/08/2023;2023-08-04 04:03;2023-08-04 20:54
05/08/2023;2023-08-05 04:06;2023-08-05 20:51
06/08/2023;2023-08-06 04:08;2023-08-06 20:49
07/08/2023;2023-08-07 04:11;2023-08-07 20:46
08/08/2023;2023-08-08 04:14;2023-08-08 20:43
09/08/2023;2023-08-09 04:16;2023-08-09 20:40
10/08/2023;2023-08-10 04:19;2023-08-10 20:37
11/08/2023;2023-08-11 04:21;2023-08-11 20:34
12/08/2023;2023-08-12 04:24;2023-08-12 20:32
13/08/2023;2023-08-13 04:26;2023-08-13 20:29
14/08/2023;2023-08-14 04:29;2023-08-14 20:26
15/08/2023;2023-08-15 04:31;2023-08-15 20:23
16/08/2023;2023-08-16 04:34;2023-08-16 20:20
17/08/2023;2023-08-17 04:37;2023-08-17 20:17
18/08/2023;2023-08-18 04:39;2023-08-18 20:14
19/08/2023;2023-08-19 04:42;2023-08-19 20:11
20/08/2023;2023-08-20 04:44;2023-08-20 20:08
21/08/2023;2023-08-21 04:47;2023-08-21 20:05
22/08/2023;2023-08-22 04:49;2023-08-22 20:02
23/08/2023;2023-08-23 04:52;2023-08-23 19:59
24/08/2023;2023-08-24 04:54;2023-08-24 19:56
25/08/2023;2023-08-25 04:57;2023-08-25 19:53
26/08/2023;2023-08-26 04:59;2023-08-26 19:50
27/08/2023;2023-08-27 05:02;2023-08-27 19:47
28/08/2023;2023-08-28 05:04;2023-08-28 19:44
29/08/2023;2023-08-29 05:07;2023-08-29 19:41
30/08/2023;2023-08-30 05:09;2023-08-30 19:37
31/08/2023;2023-08-31 05:12;2023-08-31 19:34
01/09/2023;2023-09-01 05:14;2023-09-01 19:31
02/09/2023;2023-09-02 05:17;2023-09-02 19:28
03/09/2023;2023-09-03 05:19;2023-09-03 19:25
04/09/2023;2023-09-04 05:22;2023-09-04 19:22
05/09/2023;2023-09-05 05:24;2023-09-05 19:19
06/09/2023;2023-09-06 05:27;2023-09-06 19:16
07/09/2023;2023-09-07 05:29;2023-09-07 19:12
08/09/2023;2023-09-08 05:32;2023-09-08 19:09
09/09/2023;2023-09-09 05:34;2023-09-09 19:06
10/09/2023;2023-09-10 05:37;2023-09-10 19:03
11/09/2023;2023-09-11 05:39;2023-09-11 19:00
12/09/2023;2023-09-12 05:41;2023-09-12 18:57
13/09/2023;2023-09-13 05:44;2023-09-13 18:54
14/09/2023;2023-09-14 05:46;2023-09-14 18:50
15/09/2023;2023-09-15 05:49;2023-09-15 18:47
16/09/2023;2023-09-16 05:51;2023-09-16 18:44
17/09/2023;2023-09-17 05:54;2023-09-17 18:41
18/09/2023;2023-09-18 05:56;2023-09-18 18:38
19/09/2023;2023-09-19 05:59;2023-09-19 18:35
20/09/2023;2023-09-20 06:01;2023-09-20 18:31
21/09/2023;2023-09-21 06:04;2023-09-21 18:28
22/09/2023;2023-09-22 06:06;2023-09-22 18:25
23/09/2023;2023-09-23 06:09;2023-09-23 18:22
24/09/2023;2023-09-24 06:11;2023-09-24 18:19
25/09/2023;2023-09-25 06:13;2023-09-25 18:16
26/09/2023;2023-09-26 06:16;2023-09-26 18:13
27/09/2023;2023-09-27 06:18;2023-09-27 18:09
28/09/2023;2023-09-28 06:21;2023-09-28 18:06
29/09/2023;2023-09-29 06:23;2023-09-29 18:03
30/09/2023;2023-09-30 06:26;2023-09-30 18:00
01/10/2023;2023-10-01 06:28;2023-10-01 17:57
02/10/2023;2023-10-02 06:31;2023-10-02 17:54
03/10/2023;2023-10-03 06:33;2023-10-03 17:51
04/10/2023;2023-10-04 06:36;2023-10-04 17:47
05/10/2023;2023-10-05 06:38;2023-10-05 17:44
06/10/2023;2023-10-06 06:41;2023-10-06 17:41
07/10/2023;2023-10-07 06:43;2023-10-07 17:38
08/10/2023;2023-10-08 06:46;2023-10-08 17:35
09/10/2023;2023-10-09 06:48;2023-10-09 17:32
10/10/2023;2023-10-10 06:51;2023-10-10 17:29
11/10/2023;2023-10-11 06:53;2023-10-11 17:26
12/10/2023;2023-10-12 06:56;2023-10-12 17:23
13/10/2023;2023-10-13 06:59;2023-10-13 17:20
14/10/2023;2023-10-14 07:01;2023-10-14 17:17
15/10/2023;2023-10-15 07:04;2023-10-15 17:14
16/10/2023;2023-10-16 07:06;2023-10-16 17:11
17/10/2023;2023-10-17 07:09;2023-10-17 17:08
18/10/2023;2023-10-18 07:12;2023-10-18 17:05
19/10/2023;2023-10-19 07:14;2023-10-19 17:02
20/10/2023;2023-10-20 07:17;2023-10-20 16:59
21/10/2023;2023-10-21 07:19;2023-10-21 16:56
22/10/2023;2023-10-22 07:22;2023-10-22 16:53
23/10/2023;2023-10-23 07:25;2023-10-23 16:50
24/10/2023;2023-10-24 07:27;2023-10-24 16:47
25/10/2023;2023-10-25 07:30;2023-10-25 16:44
26/10/2023;2023-10-26 07:33;2023-10-26 16:41
27/10/2023;2023-10-27 07:35;2023-10-27 16:38
28/10/2023;2023-10-28 07:38;2023-10-28 16:36
29/10/2023;2023-10-29 07:41;2023-10-29 16:33
30/10/2023;2023-10-30 07:43;2023-10-30 16:30
31/10/2023;2023-10-31 07:46;2023-10-31 16:27
01/11/2023;2023-11-01 07:49;2023-11-01 16:24
02/11/2023;2023-11-02 07:51;2023-11-02 16:22
03/11/2023;2023-11-03 07:54;2023-11-03 16:19
04/11/2023;2023-11-04 07:57;2023-11-04 16:16
05/11/2023;2023-11-05 08:00;2023-11-05 16:14
06/11/2023;2023-11-06 08:02;2023-11-06 16:11
07/11/2023;2023-11-07 08:05;2023-11-07 16:08
08/11/2023;2023-11-08 08:08;2023-11-08 16:06
09/11/2023;2023-11-09 08:10;2023-11-09 16:03
10/11/2023;2023-11-10 08:13;2023-11-10 16:01
11/11/2023;2023-11-11 08:16;2023-11-11 15:58
12/11/2023;2023-11-12 08:18;2023-11-12 15:56
13/11/2023;2023-11-13 08:21;2023-11-13 15:53
14/11/2023;2023-11-14 08:24;2023-11-14 15:51
15/11/2023;2023-11-15 08:27;2023-11-15 15:49
16/11/2023;2023-11-16 08:29;2023-11-16 15:46
17/11/2023;2023-11-17 08:32;2023-11-17 15:44
18/11/2023;2023-11-18 08:34;2023-11-18 15:42
19/11/2023;2023-11-19 08:37;2023-11-19 15:40
20/11/2023;2023-11-20 08:40;2023-11-20 15:38
21/11/2023;2023-11-21 08:42;2023-11-21 15:36
22/11/2023;2023-11-22 08:45;2023-11-22 15:34
23/11/2023;2023-11-23 08:47;2023-11-23 15:32
24/11/2023;2023-11-24 08:50;2023-11-24 15:30
25/11/2023;2023-11-25 08:52;2023-11-25 15:28
26/11/2023;2023-11-26 08:55;2023-11-26 15:26
27/11/2023;2023-11-27 08:57;2023-11-27 15:24
28/11/2023;2023-11-28 08:59;2023-11-28 15:23
29/11/2023;2023-11-29 09:02;2023-11-29 15:21
30/11/2023;2023-11-30 09:04;2023-11-30 15:20
01/12/2023;2023-12-01 09:06;2023-12-01 15:18
02/12/2023;2023-12-02 09:08;2023-12-02 15:17
03/12/2023;2023-12-03 09:10;2023-12-03 15:16
04/12/2023;2023-12-04 09:12;2023-12-04 15:14
05/12/2023;2023-12-05 09:14;2023-12-05 15:13
06/12/2023;2023-12-06 09:16;2023-12-06 15:12
07/12/2023;2023-12-07 09:18;2023-12-07 15:11
08/12/2023;2023-12-08 09:20;2023-12-08 15:10
09/12/2023;2023-12-09 09:22;2023-12-09 15:10
10/12/2023;2023-12-10 09:23;2023-12-10 15:09
11/12/2023;2023-12-11 09:25;2023-12-11 15:08
12/12/2023;2023-12-12 09:26;2023-12-12 15:08
13/12/2023;2023-12-13 09:28;2023-12-13 15:07
14/12/2023;2023-12-14 09:29;2023-12-14 15:07
15/12/2023;2023-12-15 09:30;2023-12-15 15:07
16/12/2023;2023-12-16 09:31;2023-12-16 15:07
17/12/2023;2023-12-17 09:32;2023-12-17 15:06
18/12/2023;2023-12-18 09:33;2023-12-18 15:07
19/12/2023;2023-12-19 09:34;2023-12-19 15:07
20/12/2023;2023-12-20 09:35;2023-12-20 15:07
21/12/2023;2023-12-21 09:36;2023-12-21 15:07
22/12/2023;2023-12-22 09:36;2023-12-22 15:08
23/12/2023;2023-12-23 09:36;2023-12-23 15:08
24/12/2023;2023-12-24 09:37;2023-12-24 15:09
25/12/2023;2023-12-25 09:37;2023-12-25 15:10
26/12/2023;2023-12-26 09:37;2023-12-26 15:11
27/12/2023;2023-12-27 09:37;2023-12-27 15:12
28/12/2023;2023-12-28 09:37;2023-12-28 15:13
29/12/2023;2023-12-29 09:37;2023-12-29 15:14
30/12/2023;2023-12-30 09:37;2023-12-30 15:15
31/1ı“:Hú BYõ=<ÿ≈TÈl†iJà\µVCÂ8diß¨¡¡”À≥!