01/01/2028;2028-01-01 07:33;2028-01-01 15:43
02/01/2028;2028-01-02 07:33;2028-01-02 15:44
03/01/2028;2028-01-03 07:33;2028-01-03 15:45
04/01/2028;2028-01-04 07:33;2028-01-04 15:46
05/01/2028;2028-01-05 07:32;2028-01-05 15:47
06/01/2028;2028-01-06 07:32;2028-01-06 15:48
07/01/2028;2028-01-07 07:32;2028-01-07 15:50
08/01/2028;2028-01-08 07:31;2028-01-08 15:51
09/01/2028;2028-01-09 07:31;2028-01-09 15:52
10/01/2028;2028-01-10 07:31;2028-01-10 15:53
11/01/2028;2028-01-11 07:30;2028-01-11 15:55
12/01/2028;2028-01-12 07:29;2028-01-12 15:56
13/01/2028;2028-01-13 07:29;2028-01-13 15:57
14/01/2028;2028-01-14 07:28;2028-01-14 15:59
15/01/2028;2028-01-15 07:28;2028-01-15 16:00
16/01/2028;2028-01-16 07:27;2028-01-16 16:02
17/01/2028;2028-01-17 07:26;2028-01-17 16:03
18/01/2028;2028-01-18 07:25;2028-01-18 16:05
19/01/2028;2028-01-19 07:24;2028-01-19 16:06
20/01/2028;2028-01-20 07:23;2028-01-20 16:08
21/01/2028;2028-01-21 07:22;2028-01-21 16:09
22/01/2028;2028-01-22 07:21;2028-01-22 16:11
23/01/2028;2028-01-23 07:20;2028-01-23 16:13
24/01/2028;2028-01-24 07:19;2028-01-24 16:14
25/01/2028;2028-01-25 07:18;2028-01-25 16:16
26/01/2028;2028-01-26 07:17;2028-01-26 16:18
27/01/2028;2028-01-27 07:16;2028-01-27 16:19
28/01/2028;2028-01-28 07:14;2028-01-28 16:21
29/01/2028;2028-01-29 07:13;2028-01-29 16:23
30/01/2028;2028-01-30 07:12;2028-01-30 16:24
31/01/2028;2028-01-31 07:10;2028-01-31 16:26
01/02/2028;2028-02-01 07:09;2028-02-01 16:28
02/02/2028;2028-02-02 07:07;2028-02-02 16:29
03/02/2028;2028-02-03 07:06;2028-02-03 16:31
04/02/2028;2028-02-04 07:04;2028-02-04 16:33
05/02/2028;2028-02-05 07:03;2028-02-05 16:35
06/02/2028;2028-02-06 07:01;2028-02-06 16:36
07/02/2028;2028-02-07 07:00;2028-02-07 16:38
08/02/2028;2028-02-08 06:58;2028-02-08 16:40
09/02/2028;2028-02-09 06:57;2028-02-09 16:41
10/02/2028;2028-02-10 06:55;2028-02-10 16:43
11/02/2028;2028-02-11 06:53;2028-02-11 16:45
12/02/2028;2028-02-12 06:51;2028-02-12 16:47
13/02/2028;2028-02-13 06:50;2028-02-13 16:48
14/02/2028;2028-02-14 06:48;2028-02-14 16:50
15/02/2028;2028-02-15 06:46;2028-02-15 16:52
16/02/2028;2028-02-16 06:44;2028-02-16 16:54
17/02/2028;2028-02-17 06:43;2028-02-17 16:55
18/02/2028;2028-02-18 06:41;2028-02-18 16:57
19/02/2028;2028-02-19 06:39;2028-02-19 16:59
20/02/2028;2028-02-20 06:37;2028-02-20 17:00
21/02/2028;2028-02-21 06:35;2028-02-21 17:02
22/02/2028;2028-02-22 06:33;2028-02-22 17:04
23/02/2028;2028-02-23 06:31;2028-02-23 17:05
24/02/2028;2028-02-24 06:29;2028-02-24 17:07
25/02/2028;2028-02-25 06:27;2028-02-25 17:09
26/02/2028;2028-02-26 06:25;2028-02-26 17:11
27/02/2028;2028-02-27 06:23;2028-02-27 17:12
28/02/2028;2028-02-28 06:21;2028-02-28 17:14
29/02/2028;2028-02-29 06:19;2028-02-29 17:16
01/03/2028;2028-03-01 06:17;2028-03-01 17:17
02/03/2028;2028-03-02 06:15;2028-03-02 17:19
03/03/2028;2028-03-03 06:13;2028-03-03 17:21
04/03/2028;2028-03-04 06:11;2028-03-04 17:22
05/03/2028;2028-03-05 06:09;2028-03-05 17:24
06/03/2028;2028-03-06 06:07;2028-03-06 17:25
07/03/2028;2028-03-07 06:05;2028-03-07 17:27
08/03/2028;2028-03-08 06:02;2028-03-08 17:29
09/03/2028;2028-03-09 06:00;2028-03-09 17:30
10/03/2028;2028-03-10 05:58;2028-03-10 17:32
11/03/2028;2028-03-11 05:56;2028-03-11 17:34
12/03/2028;2028-03-12 05:54;2028-03-12 17:35
13/03/2028;2028-03-13 05:52;2028-03-13 17:37
14/03/2028;2028-03-14 05:50;2028-03-14 17:38
15/03/2028;2028-03-15 05:47;2028-03-15 17:40
16/03/2028;2028-03-16 05:45;2028-03-16 17:42
17/03/2028;2028-03-17 05:43;2028-03-17 17:43
18/03/2028;2028-03-18 05:41;2028-03-18 17:45
19/03/2028;2028-03-19 05:39;2028-03-19 17:46
20/03/2028;2028-03-20 05:37;2028-03-20 17:48
21/03/2028;2028-03-21 05:34;2028-03-21 17:50
22/03/2028;2028-03-22 05:32;2028-03-22 17:51
23/03/2028;2028-03-23 05:30;2028-03-23 17:53
24/03/2028;2028-03-24 05:28;2028-03-24 17:54
25/03/2028;2028-03-25 05:26;2028-03-25 17:56
26/03/2028;2028-03-26 06:23;2028-03-26 18:57
27/03/2028;2028-03-27 06:21;2028-03-27 18:59
28/03/2028;2028-03-28 06:19;2028-03-28 19:01
29/03/2028;2028-03-29 06:17;2028-03-29 19:02
30/03/2028;2028-03-30 06:15;2028-03-30 19:04
31/03/2028;2028-03-31 06:13;2028-03-31 19:05
01/04/2028;2028-04-01 06:10;2028-04-01 19:07
02/04/2028;2028-04-02 06:08;2028-04-02 19:08
03/04/2028;2028-04-03 06:06;2028-04-03 19:10
04/04/2028;2028-04-04 06:04;2028-04-04 19:12
05/04/2028;2028-04-05 06:02;2028-04-05 19:13
06/04/2028;2028-04-06 06:00;2028-04-06 19:15
07/04/2028;2028-04-07 05:58;2028-04-07 19:16
08/04/2028;2028-04-08 05:56;2028-04-08 19:18
09/04/2028;2028-04-09 05:53;2028-04-09 19:19
10/04/2028;2028-04-10 05:51;2028-04-10 19:21
11/04/2028;2028-04-11 05:49;2028-04-11 19:23
12/04/2028;2028-04-12 05:47;2028-04-12 19:24
13/04/2028;2028-04-13 05:45;2028-04-13 19:26
14/04/2028;2028-04-14 05:43;2028-04-14 19:27
15/04/2028;2028-04-15 05:41;2028-04-15 19:29
16/04/2028;2028-04-16 05:39;2028-04-16 19:30
17/04/2028;2028-04-17 05:37;2028-04-17 19:32
18/04/2028;2028-04-18 05:35;2028-04-18 19:34
19/04/2028;2028-04-19 05:33;2028-04-19 19:35
20/04/2028;2028-04-20 05:31;2028-04-20 19:37
21/04/2028;2028-04-21 05:29;2028-04-21 19:38
22/04/2028;2028-04-22 05:27;2028-04-22 19:40
23/04/2028;2028-04-23 05:25;2028-04-23 19:41
24/04/2028;2028-04-24 05:23;2028-04-24 19:43
25/04/2028;2028-04-25 05:21;2028-04-25 19:44
26/04/2028;2028-04-26 05:19;2028-04-26 19:46
27/04/2028;2028-04-27 05:18;2028-04-27 19:48
28/04/2028;2028-04-28 05:16;2028-04-28 19:49
29/04/2028;2028-04-29 05:14;2028-04-29 19:51
30/04/2028;2028-04-30 05:12;2028-04-30 19:52
01/05/2028;2028-05-01 05:10;2028-05-01 19:54
02/05/2028;2028-05-02 05:09;2028-05-02 19:55
03/05/2028;2028-05-03 05:07;2028-05-03 19:57
04/05/2028;2028-05-04 05:05;2028-05-04 19:58
05/05/2028;2028-05-05 05:03;2028-05-05 20:00
06/05/2028;2028-05-06 05:02;2028-05-06 20:01
07/05/2028;2028-05-07 05:00;2028-05-07 20:03
08/05/2028;2028-05-08 04:59;2028-05-08 20:04
09/05/2028;2028-05-09 04:57;2028-05-09 20:06
10/05/2028;2028-05-10 04:55;2028-05-10 20:07
11/05/2028;2028-05-11 04:54;2028-05-11 20:09
12/05/2028;2028-05-12 04:52;2028-05-12 20:10
13/05/2028;2028-05-13 04:51;2028-05-13 20:12
14/05/2028;2028-05-14 04:50;2028-05-14 20:13
15/05/2028;2028-05-15 04:48;2028-05-15 20:14
16/05/2028;2028-05-16 04:47;2028-05-16 20:16
17/05/2028;2028-05-17 04:46;2028-05-17 20:17
18/05/2028;2028-05-18 04:44;2028-05-18 20:19
19/05/2028;2028-05-19 04:43;2028-05-19 20:20
20/05/2028;2028-05-20 04:42;2028-05-20 20:21
21/05/2028;2028-05-21 04:41;2028-05-21 20:22
22/05/2028;2028-05-22 04:39;2028-05-22 20:24
23/05/2028;2028-05-23 04:38;2028-05-23 20:25
24/05/2028;2028-05-24 04:37;2028-05-24 20:26
25/05/2028;2028-05-25 04:36;2028-05-25 20:27
26/05/2028;2028-05-26 04:35;2028-05-26 20:29
27/05/2028;2028-05-27 04:34;2028-05-27 20:30
28/05/2028;2028-05-28 04:33;2028-05-28 20:31
29/05/2028;2028-05-29 04:33;2028-05-29 20:32
30/05/2028;2028-05-30 04:32;2028-05-30 20:33
31/05/2028;2028-05-31 04:31;2028-05-31 20:34
01/06/2028;2028-06-01 04:30;2028-06-01 20:35
02/06/2028;2028-06-02 04:30;2028-06-02 20:36
03/06/2028;2028-06-03 04:29;2028-06-03 20:37
04/06/2028;2028-06-04 04:28;2028-06-04 20:38
05/06/2028;2028-06-05 04:28;2028-06-05 20:39
06/06/2028;2028-06-06 04:27;2028-06-06 20:40
07/06/2028;2028-06-07 04:27;2028-06-07 20:41
08/06/2028;2028-06-08 04:26;2028-06-08 20:41
09/06/2028;2028-06-09 04:26;2028-06-09 20:42
10/06/2028;2028-06-10 04:26;2028-06-10 20:43
11/06/2028;2028-06-11 04:25;2028-06-11 20:43
12/06/2028;2028-06-12 04:25;2028-06-12 20:44
13/06/2028;2028-06-13 04:25;2028-06-13 20:45
14/06/2028;2028-06-14 04:25;2028-06-14 20:45
15/06/2028;2028-06-15 04:25;2028-06-15 20:46
16/06/2028;2028-06-16 04:25;2028-06-16 20:46
17/06/2028;2028-06-17 04:25;2028-06-17 20:46
18/06/2028;2028-06-18 04:25;2028-06-18 20:47
19/06/2028;2028-06-19 04:25;2028-06-19 20:47
20/06/2028;2028-06-20 04:25;2028-06-20 20:47
21/06/2028;2028-06-21 04:25;2028-06-21 20:47
22/06/2028;2028-06-22 04:26;2028-06-22 20:48
23/06/2028;2028-06-23 04:26;2028-06-23 20:48
24/06/2028;2028-06-24 04:26;2028-06-24 20:48
25/06/2028;2028-06-25 04:27;2028-06-25 20:48
26/06/2028;2028-06-26 04:27;2028-06-26 20:48
27/06/2028;2028-06-27 04:28;2028-06-27 20:48
28/06/2028;2028-06-28 04:28;2028-06-28 20:48
29/06/2028;2028-06-29 04:29;2028-06-29 20:47
30/06/2028;2028-06-30 04:29;2028-06-30 20:47
01/07/2028;2028-07-01 04:30;2028-07-01 20:47
02/07/2028;2028-07-02 04:31;2028-07-02 20:46
03/07/2028;2028-07-03 04:31;2028-07-03 20:46
04/07/2028;2028-07-04 04:32;2028-07-04 20:46
05/07/2028;2028-07-05 04:33;2028-07-05 20:45
06/07/2028;2028-07-06 04:34;2028-07-06 20:45
07/07/2028;2028-07-07 04:35;2028-07-07 20:44
08/07/2028;2028-07-08 04:35;2028-07-08 20:43
09/07/2028;2028-07-09 04:36;2028-07-09 20:43
10/07/2028;2028-07-10 04:37;2028-07-10 20:42
11/07/2028;2028-07-11 04:38;2028-07-11 20:41
12/07/2028;2028-07-12 04:39;2028-07-12 20:41
13/07/2028;2028-07-13 04:40;2028-07-13 20:40
14/07/2028;2028-07-14 04:41;2028-07-14 20:39
15/07/2028;2028-07-15 04:43;2028-07-15 20:38
16/07/2028;2028-07-16 04:44;2028-07-16 20:37
17/07/2028;2028-07-17 04:45;2028-07-17 20:36
18/07/2028;2028-07-18 04:46;2028-07-18 20:35
19/07/2028;2028-07-19 04:47;2028-07-19 20:34
20/07/2028;2028-07-20 04:48;2028-07-20 20:33
21/07/2028;2028-07-21 04:50;2028-07-21 20:31
22/07/2028;2028-07-22 04:51;2028-07-22 20:30
23/07/2028;2028-07-23 04:52;2028-07-23 20:29
24/07/2028;2028-07-24 04:53;2028-07-24 20:28
25/07/2028;2028-07-25 04:55;2028-07-25 20:26
26/07/2028;2028-07-26 04:56;2028-07-26 20:25
27/07/2028;2028-07-27 04:57;2028-07-27 20:24
28/07/2028;2028-07-28 04:59;2028-07-28 20:22
29/07/2028;2028-07-29 05:00;2028-07-29 20:21
30/07/2028;2028-07-30 05:02;2028-07-30 20:19
31/07/2028;2028-07-31 05:03;2028-07-31 20:18
01/08/2028;2028-08-01 05:04;2028-08-01 20:16
02/08/2028;2028-08-02 05:06;2028-08-02 20:15
03/08/2028;2028-08-03 05:07;2028-08-03 20:13
04/08/2028;2028-08-04 05:09;2028-08-04 20:12
05/08/2028;2028-08-05 05:10;2028-08-05 20:10
06/08/2028;2028-08-06 05:12;2028-08-06 20:08
07/08/2028;2028-08-07 05:13;2028-08-07 20:07
08/08/2028;2028-08-08 05:14;2028-08-08 20:05
09/08/2028;2028-08-09 05:16;2028-08-09 20:03
10/08/2028;2028-08-10 05:17;2028-08-10 20:01
11/08/2028;2028-08-11 05:19;2028-08-11 19:59
12/08/2028;2028-08-12 05:20;2028-08-12 19:58
13/08/2028;2028-08-13 05:22;2028-08-13 19:56
14/08/2028;2028-08-14 05:23;2028-08-14 19:54
15/08/2028;2028-08-15 05:25;2028-08-15 19:52
16/08/2028;2028-08-16 05:26;2028-08-16 19:50
17/08/2028;2028-08-17 05:28;2028-08-17 19:48
18/08/2028;2028-08-18 05:29;2028-08-18 19:46
19/08/2028;2028-08-19 05:31;2028-08-19 19:44
20/08/2028;2028-08-20 05:32;2028-08-20 19:42
21/08/2028;2028-08-21 05:34;2028-08-21 19:40
22/08/2028;2028-08-22 05:35;2028-08-22 19:38
23/08/2028;2028-08-23 05:37;2028-08-23 19:36
24/08/2028;2028-08-24 05:38;2028-08-24 19:34
25/08/2028;2028-08-25 05:40;2028-08-25 19:32
26/08/2028;2028-08-26 05:41;2028-08-26 19:30
27/08/2028;2028-08-27 05:43;2028-08-27 19:28
28/08/2028;2028-08-28 05:44;2028-08-28 19:26
29/08/2028;2028-08-29 05:46;2028-08-29 19:24
30/08/2028;2028-08-30 05:47;2028-08-30 19:22
31/08/2028;2028-08-31 05:49;2028-08-31 19:20
01/09/2028;2028-09-01 05:50;2028-09-01 19:18
02/09/2028;2028-09-02 05:51;2028-09-02 19:16
03/09/2028;2028-09-03 05:53;2028-09-03 19:13
04/09/2028;2028-09-04 05:54;2028-09-04 19:11
05/09/2028;2028-09-05 05:56;2028-09-05 19:09
06/09/2028;2028-09-06 05:57;2028-09-06 19:07
07/09/2028;2028-09-07 05:59;2028-09-07 19:05
08/09/2028;2028-09-08 06:00;2028-09-08 19:03
09/09/2028;2028-09-09 06:02;2028-09-09 19:00
10/09/2028;2028-09-10 06:03;2028-09-10 18:58
11/09/2028;2028-09-11 06:05;2028-09-11 18:56
12/09/2028;2028-09-12 06:06;2028-09-12 18:54
13/09/2028;2028-09-13 06:08;2028-09-13 18:52
14/09/2028;2028-09-14 06:09;2028-09-14 18:49
15/09/2028;2028-09-15 06:11;2028-09-15 18:47
16/09/2028;2028-09-16 06:12;2028-09-16 18:45
17/09/2028;2028-09-17 06:14;2028-09-17 18:43
18/09/2028;2028-09-18 06:15;2028-09-18 18:41
19/09/2028;2028-09-19 06:17;2028-09-19 18:38
20/09/2028;2028-09-20 06:18;2028-09-20 18:36
21/09/2028;2028-09-21 06:20;2028-09-21 18:34
22/09/2028;2028-09-22 06:21;2028-09-22 18:32
23/09/2028;2028-09-23 06:23;2028-09-23 18:30
24/09/2028;2028-09-24 06:24;2028-09-24 18:27
25/09/2028;2028-09-25 06:26;2028-09-25 18:25
26/09/2028;2028-09-26 06:27;2028-09-26 18:23
27/09/2028;2028-09-27 06:29;2028-09-27 18:21
28/09/2028;2028-09-28 06:30;2028-09-28 18:19
29/09/2028;2028-09-29 06:32;2028-09-29 18:16
30/09/2028;2028-09-30 06:33;2028-09-30 18:14
01/10/2028;2028-10-01 06:35;2028-10-01 18:12
02/10/2028;2028-10-02 06:36;2028-10-02 18:10
03/10/2028;2028-10-03 06:38;2028-10-03 18:08
04/10/2028;2028-10-04 06:40;2028-10-04 18:06
05/10/2028;2028-10-05 06:41;2028-10-05 18:04
06/10/2028;2028-10-06 06:43;2028-10-06 18:01
07/10/2028;2028-10-07 06:44;2028-10-07 17:59
08/10/2028;2028-10-08 06:46;2028-10-08 17:57
09/10/2028;2028-10-09 06:47;2028-10-09 17:55
10/10/2028;2028-10-10 06:49;2028-10-10 17:53
11/10/2028;2028-10-11 06:50;2028-10-11 17:51
12/10/2028;2028-10-12 06:52;2028-10-12 17:49
13/10/2028;2028-10-13 06:54;2028-10-13 17:47
14/10/2028;2028-10-14 06:55;2028-10-14 17:45
15/10/2028;2028-10-15 06:57;2028-10-15 17:43
16/10/2028;2028-10-16 06:58;2028-10-16 17:41
17/10/2028;2028-10-17 07:00;2028-10-17 17:39
18/10/2028;2028-10-18 07:02;2028-10-18 17:37
19/10/2028;2028-10-19 07:03;2028-10-19 17:35
20/10/2028;2028-10-20 07:05;2028-10-20 17:33
21/10/2028;2028-10-21 07:06;2028-10-21 17:31
22/10/2028;2028-10-22 07:08;2028-10-22 17:29
23/10/2028;2028-10-23 07:10;2028-10-23 17:27
24/10/2028;2028-10-24 07:11;2028-10-24 17:25
25/10/2028;2028-10-25 07:13;2028-10-25 17:23
26/10/2028;2028-10-26 07:15;2028-10-26 17:21
27/10/2028;2028-10-27 07:16;2028-10-27 17:19
28/10/2028;2028-10-28 07:18;2028-10-28 17:18
29/10/2028;2028-10-29 06:20;2028-10-29 16:16
30/10/2028;2028-10-30 06:21;2028-10-30 16:14
31/10/2028;2028-10-31 06:23;2028-10-31 16:12
01/11/2028;2028-11-01 06:25;2028-11-01 16:11
02/11/2028;2028-11-02 06:26;2028-11-02 16:09
03/11/2028;2028-11-03 06:28;2028-11-03 16:07
04/11/2028;2028-11-04 06:30;2028-11-04 16:06
05/11/2028;2028-11-05 06:31;2028-11-05 16:04
06/11/2028;2028-11-06 06:33;2028-11-06 16:03
07/11/2028;2028-11-07 06:35;2028-11-07 16:01
08/11/2028;2028-11-08 06:36;2028-11-08 16:00
09/11/2028;2028-11-09 06:38;2028-11-09 15:58
10/11/2028;2028-11-10 06:40;2028-11-10 15:57
11/11/2028;2028-11-11 06:41;2028-11-11 15:55
12/11/2028;2028-11-12 06:43;2028-11-12 15:54
13/11/2028;2028-11-13 06:44;2028-11-13 15:53
14/11/2028;2028-11-14 06:46;2028-11-14 15:51
15/11/2028;2028-11-15 06:48;2028-11-15 15:50
16/11/2028;2028-11-16 06:49;2028-11-16 15:49
17/11/2028;2028-11-17 06:51;2028-11-17 15:48
18/11/2028;2028-11-18 06:53;2028-11-18 15:46
19/11/2028;2028-11-19 06:54;2028-11-19 15:45
20/11/2028;2028-11-20 06:56;2028-11-20 15:44
21/11/2028;2028-11-21 06:57;2028-11-21 15:43
22/11/2028;2028-11-22 06:59;2028-11-22 15:42
23/11/2028;2028-11-23 07:00;2028-11-23 15:41
24/11/2028;2028-11-24 07:02;2028-11-24 15:40
25/11/2028;2028-11-25 07:03;2028-11-25 15:40
26/11/2028;2028-11-26 07:05;2028-11-26 15:39
27/11/2028;2028-11-27 07:06;2028-11-27 15:38
28/11/2028;2028-11-28 07:08;2028-11-28 15:37
29/11/2028;2028-11-29 07:09;2028-11-29 15:37
30/11/2028;2028-11-30 07:10;2028-11-30 15:36
01/12/2028;2028-12-01 07:12;2028-12-01 15:35
02/12/2028;2028-12-02 07:13;2028-12-02 15:35
03/12/2028;2028-12-03 07:14;2028-12-03 15:35
04/12/2028;2028-12-04 07:15;2028-12-04 15:34
05/12/2028;2028-12-05 07:17;2028-12-05 15:34
06/12/2028;2028-12-06 07:18;2028-12-06 15:33
07/12/2028;2028-12-07 07:19;2028-12-07 15:33
08/12/2028;2028-12-08 07:20;2028-12-08 15:33
09/12/2028;2028-12-09 07:21;2028-12-09 15:33
10/12/2028;2028-12-10 07:22;2028-12-10 15:33
11/12/2028;2028-12-11 07:23;2028-12-11 15:33
12/12/2028;2028-12-12 07:24;2028-12-12 15:33
13/12/2028;2028-12-13 07:25;2028-12-13 15:33
14/12/2028;2028-12-14 07:26;2028-12-14 15:33
15/12/2028;2028-12-15 07:27;2028-12-15 15:33
16/12/2028;2028-12-16 07:27;2028-12-16 15:33
17/12/2028;2028-12-17 07:28;2028-12-17 15:34
18/12/2028;2028-12-18 07:29;2028-12-18 15:34
19/12/2028;2028-12-19 07:29;2028-12-19 15:34
20/12/2028;2028-12-20 07:30;2028-12-20 15:35
21/12/2028;2028-12-21 07:31;2028-12-21 15:35
22/12/2028;2028-12-22 07:31;2028-12-22 15:36
23/12/2028;2028-12-23 07:31;2028-12-23 15:36
24/12/2028;2028-12-24 07:32;2028-12-24 15:37
25/12/2028;2028-12-25 07:32;2028-12-25 15:38
26/12/2028;2028-12-26 07:32;2028-12-26 15:38
27/12/2028;2028-12-27 07:33;2028-12-27 15:39
28/12/2028;2028-12-28 07:33;2028-12-28 15:40
29/12/2028;2028-12-29 07:33;2028-12-29 15:41
30/12/2028;2028-12-30 07:33;2028-12-30 15:42
31/12/2028;2028-12-31 07:33;2028-12-31 15:43
